{
  "ir": "bdp-query-design-1",
  "profile": "query",
  "selection": {
    "op": "filter",
    "input": {
      "op": "refs",
      "collection": "beads",
      "references": ["https://work.example/acme/A"]
    },
    "bind": "b",
    "predicate": {
      "op": "all",
      "input": {
        "op": "walk",
        "roots": {
          "op": "binding",
          "name": "b"
        },
        "direction": "outgoing",
        "depth": "unbounded",
        "bind": "link",
        "through": {
          "op": "typeIs",
          "of": {
            "op": "binding",
            "name": "link"
          },
          "type": "https://work.example/acme/requires",
          "match": "family"
        }
      },
      "bind": "link",
      "predicate": {
        "op": "compare",
        "operator": "eq",
        "left": {
          "op": "field",
          "of": {
            "op": "endpoint",
            "of": {
              "op": "binding",
              "name": "link"
            },
            "side": "target"
          },
          "path": ["properties", "status"]
        },
        "right": {
          "op": "literal",
          "value": "ratified"
        }
      }
    }
  },
  "result": {
    "form": "resources"
  }
}
